{"slug":"mazda-lm-vision","status":"asset-processing","make":"Mazda","model":"LM Vision","generation":"Concept","type":"car","years":[2015,null],"tier":"reference","summary":"User-supplied 3D asset under technical review. Specifications and exact variant details are not yet verified.","specs":[],"model3d":{"glb":"/models/mazda-lm-vision.glb","credit":"User-supplied model; provenance unverified","accuracyNotes":"Pending visual and provenance review.","fileSizeBytes":26409596,"originalHash":"219662E4365B2DAE935B2DB79A8E0657662CF0AF28C1B22BC191D8F273D75FB8"}}
