{"slug":"lamborghini-countach-5000qv","status":"asset-processing","make":"Lamborghini","model":"Countach 5000 QV","generation":"1985–1988","type":"car","years":[1985,1988],"tier":"reference","summary":"User-supplied 3D asset under technical review. Specifications are not yet verified.","specs":[],"model3d":{"glb":"/models/lamborghini-countach-5000qv.glb","credit":"User-supplied model; provenance unverified","accuracyNotes":"Pending visual and provenance review.","fileSizeBytes":13341608,"originalHash":"4A2D4643E34A0B67C0638D830037587214B3A53CF73714E47A8AE2101CD325C2"}}
