{"slug":"plymouth-hemi-cuda-1971","status":"asset-processing","make":"Plymouth","model":"Hemi Cuda","generation":"1971","type":"car","years":[1971,1971],"tier":"reference","summary":"User-supplied 3D asset under technical review. Specifications are not yet verified.","specs":[],"model3d":{"glb":"/models/plymouth-hemi-cuda-1971.glb","credit":"User-supplied model; provenance unverified","accuracyNotes":"Pending visual and provenance review.","fileSizeBytes":11358152,"originalHash":"F9F95428D55ADE58DCB4FBBA8BCA731FBBDD09A9378EBC8A2B2AB72BFC0E67D6"}}
