{"slug":"delorean-dmc-12-time-machine","status":"asset-processing","make":"DeLorean","model":"DMC-12 Time Machine","generation":"1985 film replica","type":"car","years":[1981,1983],"tier":"reference","summary":"User-supplied film-replica 3D asset under technical review. Specifications are not yet verified.","specs":[],"model3d":{"glb":"/models/delorean-dmc-12-time-machine.glb","credit":"User-supplied model; provenance unverified","accuracyNotes":"Film replica; pending visual and provenance review.","fileSizeBytes":27948568,"originalHash":"958665FD1E187D52AFC7BDF8F91468C89E762286AA938F6C4FC8D2F62239A550"}}
