{"slug":"porsche-911-930-turbo-1975","status":"asset-processing","make":"Porsche","model":"911 Turbo 930","generation":"1975","type":"car","years":[1975,1975],"tier":"reference","summary":"User-supplied 3D asset under technical review. Specifications are not yet verified.","specs":[],"model3d":{"glb":"/models/porsche-911-930-turbo-1975.glb","credit":"User-supplied model; provenance unverified","accuracyNotes":"Pending visual and provenance review.","fileSizeBytes":74682604,"originalHash":"2571B4A70DB59027709CC4E8C1AA42106E94D69801455387C95E12FE31458B33"}}
