{"slug":"nissan-skyline-r34-brians","status":"asset-processing","make":"Nissan","model":"Skyline GT-R R34 — Brian's replica","generation":"Film replica","type":"car","years":[1999,2002],"tier":"reference","summary":"User-supplied film-replica 3D asset under technical review. Specifications are not yet verified.","specs":[],"model3d":{"glb":"/models/nissan-skyline-r34-brians.glb","credit":"User-supplied model; provenance unverified","accuracyNotes":"Film replica; pending visual and provenance review.","fileSizeBytes":16250684,"originalHash":"2FD291AB05364064D1DBCAD0AE3AED96A2418625EF445CF00B44389C281DB467"}}
