{"slug":"porsche-911-carrera-4s","status":"asset-processing","make":"Porsche","model":"911 Carrera 4S Cabriolet","generation":"992 / 2019","type":"car","years":[2019,2019],"tier":"reference","summary":"User-supplied 3D asset under technical review. Specifications are not yet verified.","specs":[],"model3d":{"glb":"/models/porsche-911-carrera-4s.glb","credit":"User-supplied model; provenance unverified","accuracyNotes":"2019 992 Cabriolet; pending visual and provenance review.","fileSizeBytes":14306888,"originalHash":"75F3924035112DE7D4352C685C2D081566669A4A67F50815607F9D56A132AAE4"}}
